<?xml version="1.0" encoding="UTF-8"?>

<algorithm xmlns="http://www.w3schools.com"
           xmlns:xsi="http://www.w3.org/2001/XMLSchema-instance"
           xsi:schemaLocation="http://www.w3schools.com algorithm_schema.xsd">

    <iterations>2000</iterations>

    <construction>
        <insertion name="bestInsertion">
            <allowVehicleSwitch>false</allowVehicleSwitch>
        </insertion>
    </construction>

    <strategy>
        <memory>1</memory>
        <searchStrategies>
            <searchStrategy name="random_best">
                <selector name="selectBest"/>
                <acceptor name="acceptNewRemoveWorst"/>

                <modules>
                    <module name="ruin_and_recreate">
                        <ruin name="randomRuin">
                            <share>0.3</share>
                        </ruin>
                        <insertion name="bestInsertion"/>
                    </module>

                </modules>
                <probability>0.2</probability>
            </searchStrategy>

            <searchStrategy name="radial_best">
                <selector name="selectBest"/>
                <acceptor name="acceptNewRemoveWorst"/>

                <modules>
                    <module name="ruin_and_recreate">
                        <ruin id="1" name="radialRuin">
                            <share>0.15</share>
                        </ruin>
                        <insertion name="bestInsertion"/>
                    </module>

                </modules>
                <probability>0.2</probability>
            </searchStrategy>

            <searchStrategy name="small_radial_best">
                <selector name="selectBest"/>
                <acceptor name="acceptNewRemoveWorst"/>
                <modules>
                    <module name="ruin_and_recreate">
                        <ruin id="2" name="radialRuin">
                            <share>0.05</share>
                        </ruin>
                        <insertion name="bestInsertion"/>
                    </module>

                </modules>
                <probability>0.6</probability>
            </searchStrategy>

        </searchStrategies>
    </strategy>


</algorithm>
