<?xml version="1.0" ?>

<algorithm xmlns="http://www.w3schools.com"
           xmlns:xsi="http://www.w3.org/2001/XMLSchema-instance"
           xsi:schemaLocation="http://www.w3schools.com algorithm_schema.xsd">

    <iterations>10</iterations>


    <construction>
        <insertion name="bestInsertion"/>
    </construction>

    <strategy>
        <memory>1</memory>
        <searchStrategies>
            <searchStrategy name="randomRuinAndRecreate">
                <selector name="selectBest"/>
                <acceptor name="acceptNewRemoveWorst"/>
                <modules>
                    <module name="ruin_and_recreate">
                        <ruin name="randomRuin">
                            <share>0.5</share>
                        </ruin>
                        <insertion name="bestInsertion"/>
                    </module>
                </modules>
                <probability>0.4</probability>
            </searchStrategy>

            <searchStrategy name="randomRuinSmall">
                <selector name="selectBest"/>
                <acceptor name="acceptNewRemoveWorst"/>
                <modules>
                    <module name="ruin_and_recreate">
                        <ruin name="randomRuin">
                            <share>0.1</share>
                        </ruin>
                        <insertion name="regretInsertion"/>
                    </module>
                </modules>
                <probability>0.4</probability>
            </searchStrategy>

            <searchStrategy name="radialRuinAndRecreate">
                <selector name="selectBest"/>
                <acceptor name="acceptNewRemoveWorst"/>
                <modules>
                    <module name="ruin_and_recreate">
                        <ruin name="radialRuin">
                            <share>0.3</share>
                        </ruin>
                        <insertion name="bestInsertion" id="1"/>
                    </module>
                </modules>
                <probability>0.2</probability>
            </searchStrategy>

            <!-- 			<searchStrategy id="gendreauPostOpt"> -->
            <!-- 				<modules number="1"> -->
            <!-- 					<module name="gendreau"> -->
            <!-- 						<iterations>200</iterations> -->
            <!-- 		 				<share>0.2</share> -->
            <!-- 					</module> -->
            <!-- 				</modules> -->
            <!-- 				<probability>0.1</probability> -->
            <!-- 			</searchStrategy> -->
        </searchStrategies>

    </strategy>


</algorithm>
