<?xml version="1.0" encoding="UTF-8"?>

<!--~~~~~~~~~~~~~~~~~~~~~~~~~~~~~~~~~~~~~~~~~~~~~~~~~~~~~~~~~~~~~~~~~~~~~~~~~~~~
  ~ Copyright (C) 2014  Stefan Schroeder
  ~
  ~ This library is free software; you can redistribute it and/or
  ~ modify it under the terms of the GNU Lesser General Public
  ~ License as published by the Free Software Foundation; either
  ~ version 3.0 of the License, or (at your option) any later version.
  ~
  ~ This library is distributed in the hope that it will be useful,
  ~ but WITHOUT ANY WARRANTY; without even the implied warranty of
  ~ MERCHANTABILITY or FITNESS FOR A PARTICULAR PURPOSE.  See the GNU
  ~ Lesser General Public License for more details.
  ~
  ~ You should have received a copy of the GNU Lesser General Public
  ~ License along with this library.  If not, see <http://www.gnu.org/licenses/>.
  ~~~~~~~~~~~~~~~~~~~~~~~~~~~~~~~~~~~~~~~~~~~~~~~~~~~~~~~~~~~~~~~~~~~~~~~~~~~-->

<algorithm xmlns="http://www.w3schools.com"
     xmlns:xsi="http://www.w3.org/2001/XMLSchema-instance" xsi:schemaLocation="http://www.w3schools.com algorithm_schema.xsd">
	
	<maxIterations>2000</maxIterations>

	<construction>
		<insertion name="bestInsertion"/>	
	</construction>
	
	<strategy>
		<memory>1</memory>
		<searchStrategies>
			<searchStrategy name="radialRuinAndRecreate">
				<selector name="selectBest"/>
				<acceptor name="schrimpfAcceptance">
					<alpha>0.1</alpha>
					<warmup>20</warmup>
				</acceptor>
					
				<modules>
					<module name="ruin_and_recreate">
						<ruin name="randomRuin">
							<share>0.5</share>
						</ruin>
						<insertion name="bestInsertion"/>					
					</module>
					
				</modules>
				<probability>0.5</probability>
			</searchStrategy>
			
			<searchStrategy name="radialRuinAndRecreate">
				<selector name="selectBest"/>
				<acceptor name="schrimpfAcceptance"/>
					
				<modules>
					<module name="ruin_and_recreate">
						<ruin id="1" name="radialRuin">
							<share>0.3</share>
						</ruin>
						<insertion name="bestInsertion"/>					
					</module>
					
				</modules>
				<probability>0.5</probability>
			</searchStrategy>
			
		</searchStrategies>		
	</strategy>
	

</algorithm>
